{
  "version": 1,
  "launch_nonce": "aaaaaaaa-aaaa-4aaa-8aaa-aaaaaaaaaaaa",
  "watchdog_boot_id": "bbbbbbbb-bbbb-4bbb-8bbb-bbbbbbbbbbbb",
  "component_id": "harness",
  "expected_peer": {
    "platform": "linux",
    "pid": 42,
    "creation_token": "123456789",
    "executable": "/opt/ascension/watchdog",
    "executable_sha256": "1111111111111111111111111111111111111111111111111111111111111111",
    "uid": 1000,
    "gid": 1000
  }
}
